{
  "$schema": "../../schema/journey.schema.json",
  "title": "Adriatic Crossing",
  "subtitle": "Italy → Albania → Sofia · a fictional example route",
  "totalMiles": 415,
  "weatherMonth": "June 2027",
  "stays": [
    {
      "area": "Bari",
      "hotel": "Ostello Levante",
      "lat": 41.126,
      "lon": 16.866,
      "dates": "Jun 3"
    },
    {
      "area": "Durrës",
      "hotel": "Hotel Adriatik",
      "lat": 41.309,
      "lon": 19.446,
      "dates": "Jun 4"
    },
    {
      "area": "Tirana",
      "hotel": "Rogner Tirana",
      "lat": 41.324,
      "lon": 19.82,
      "dates": "Jun 5–6"
    },
    {
      "area": "Ohrid",
      "hotel": "Villa Sofija",
      "lat": 41.114,
      "lon": 20.802,
      "dates": "Jun 7"
    },
    {
      "area": "Skopje",
      "hotel": "Hotel Solun",
      "lat": 41.994,
      "lon": 21.43,
      "dates": "Jun 8"
    },
    {
      "area": "Sofia",
      "hotel": "Sense Hotel",
      "lat": 42.696,
      "lon": 23.32,
      "dates": "Jun 9–10"
    }
  ],
  "pois": [
    {
      "name": "Polignano a Mare",
      "lat": 40.996,
      "lon": 17.22
    },
    {
      "name": "Krujë Castle",
      "lat": 41.509,
      "lon": 19.793
    },
    {
      "name": "Ohrid Old Town",
      "lat": 41.116,
      "lon": 20.788
    },
    {
      "name": "Bay of the Bones",
      "lat": 41.03,
      "lon": 20.783
    },
    {
      "name": "Sv. Naum",
      "lat": 40.914,
      "lon": 20.742
    },
    {
      "name": "Matka Canyon",
      "lat": 41.958,
      "lon": 21.3
    },
    {
      "name": "Rila Monastery",
      "lat": 42.133,
      "lon": 23.34
    }
  ],
  "ferries": [
    {
      "num": 1,
      "short": "Bari → Durrës",
      "vessel": "MV Adriatico",
      "size": "180 m · 900 pax",
      "dur": "8h 00m",
      "a": [
        41.135,
        16.855
      ],
      "b": [
        41.31,
        19.45
      ]
    },
    {
      "num": 2,
      "short": "Ohrid → Sv. Naum",
      "vessel": "Ohrid Star",
      "size": "24 m · 80 pax",
      "dur": "1h 15m",
      "a": [
        41.113,
        20.8
      ],
      "b": [
        40.914,
        20.742
      ]
    }
  ],
  "drives": [
    {
      "label": "Puglia coast to the port",
      "segs": [
        {
          "cls": "minor",
          "line": [
            [
              40.996,
              17.22
            ],
            [
              41.055,
              17.05
            ],
            [
              41.117,
              16.905
            ],
            [
              41.14,
              16.872
            ]
          ]
        }
      ]
    },
    {
      "label": "Durrës → Sofia",
      "segs": [
        {
          "cls": "motorway",
          "line": [
            [
              41.323,
              19.454
            ],
            [
              41.324,
              19.56
            ],
            [
              41.32,
              19.69
            ],
            [
              41.327,
              19.819
            ]
          ]
        },
        {
          "cls": "a",
          "line": [
            [
              41.327,
              19.819
            ],
            [
              41.25,
              19.9
            ],
            [
              41.165,
              20.01
            ],
            [
              41.112,
              20.082
            ]
          ]
        },
        {
          "cls": "a",
          "line": [
            [
              41.112,
              20.082
            ],
            [
              41.02,
              20.25
            ],
            [
              40.93,
              20.5
            ],
            [
              40.902,
              20.653
            ],
            [
              40.98,
              20.7
            ],
            [
              41.05,
              20.76
            ],
            [
              41.117,
              20.801
            ]
          ]
        },
        {
          "cls": "motorway",
          "line": [
            [
              41.117,
              20.801
            ],
            [
              41.3,
              20.9
            ],
            [
              41.55,
              21.1
            ],
            [
              41.78,
              21.3
            ],
            [
              41.998,
              21.428
            ]
          ]
        },
        {
          "cls": "motorway",
          "line": [
            [
              41.998,
              21.428
            ],
            [
              42.1,
              21.8
            ],
            [
              42.18,
              22.25
            ],
            [
              42.24,
              22.52
            ],
            [
              42.35,
              22.85
            ],
            [
              42.5,
              23.05
            ],
            [
              42.62,
              23.23
            ],
            [
              42.698,
              23.322
            ]
          ]
        }
      ]
    }
  ],
  "roadStats": [
    {
      "cls": "motorway",
      "label": "Motorway",
      "mi": 250
    },
    {
      "cls": "a",
      "label": "A-road",
      "mi": 110
    },
    {
      "cls": "b",
      "label": "B-road",
      "mi": 35
    },
    {
      "cls": "minor",
      "label": "Single-track / minor",
      "mi": 20
    }
  ],
  "weather": [
    {
      "d": "3",
      "where": "Bari",
      "icon": "☀️",
      "t": "22–29°C · 72–84°F"
    },
    {
      "d": "4",
      "where": "Durrës",
      "icon": "🌤",
      "t": "21–28°C · 70–82°F"
    },
    {
      "d": "5",
      "where": "Tirana",
      "icon": "⛅",
      "t": "19–30°C · 66–86°F"
    },
    {
      "d": "6",
      "where": "Tirana",
      "icon": "🌦",
      "t": "18–27°C · 64–81°F"
    },
    {
      "d": "7",
      "where": "Ohrid",
      "icon": "☀️",
      "t": "17–28°C · 63–82°F"
    },
    {
      "d": "8",
      "where": "Skopje",
      "icon": "☀️",
      "t": "20–33°C · 68–91°F"
    },
    {
      "d": "9",
      "where": "Sofia",
      "icon": "⛈️",
      "t": "16–26°C · 61–79°F"
    },
    {
      "d": "10",
      "where": "Sofia",
      "icon": "🌤",
      "t": "17–27°C · 63–81°F"
    }
  ],
  "insets": [
    {
      "title": "Lake Ohrid",
      "center": [
        41.02,
        20.75
      ],
      "zoom": 10,
      "cx": 252,
      "cy": 640,
      "r": 238,
      "poiKm": 22
    },
    {
      "title": "Skopje & Matka",
      "center": [
        41.97,
        21.37
      ],
      "zoom": 10.5,
      "cx": 1356,
      "cy": 312,
      "r": 205,
      "poiKm": 18,
      "capMode": "vert"
    }
  ],
  "note": {
    "anchor": [
      41.75,
      18.35
    ],
    "tip": [
      42.35,
      20
    ],
    "title": "Accursed Mountains — snowed in 🏔️",
    "sub": "took the coast road instead"
  },
  "finale": {
    "from": [
      42.698,
      23.322
    ],
    "dx": 150,
    "label": "Sofia · onward → Istanbul ✈"
  },
  "elevation": [
    {
      "mi": 0,
      "m": 0
    },
    {
      "mi": 9,
      "m": 47
    },
    {
      "mi": 18.1,
      "m": 0
    },
    {
      "mi": 27.1,
      "m": 0
    },
    {
      "mi": 36.2,
      "m": 0
    },
    {
      "mi": 45.2,
      "m": 0
    },
    {
      "mi": 54.3,
      "m": 0
    },
    {
      "mi": 63.3,
      "m": 0
    },
    {
      "mi": 72.4,
      "m": 0
    },
    {
      "mi": 81.4,
      "m": 0
    },
    {
      "mi": 90.5,
      "m": 0
    },
    {
      "mi": 99.5,
      "m": 0
    },
    {
      "mi": 108.6,
      "m": 0
    },
    {
      "mi": 117.6,
      "m": 0
    },
    {
      "mi": 126.6,
      "m": 0
    },
    {
      "mi": 135.7,
      "m": 0
    },
    {
      "mi": 144.7,
      "m": 0
    },
    {
      "mi": 153.8,
      "m": 0
    },
    {
      "mi": 162.8,
      "m": 55
    },
    {
      "mi": 171.9,
      "m": 104
    },
    {
      "mi": 180.9,
      "m": 167
    },
    {
      "mi": 190,
      "m": 391
    },
    {
      "mi": 199,
      "m": 588
    },
    {
      "mi": 208.1,
      "m": 1541
    },
    {
      "mi": 217.1,
      "m": 1061
    },
    {
      "mi": 226.2,
      "m": 1267
    },
    {
      "mi": 235.2,
      "m": 693
    },
    {
      "mi": 244.2,
      "m": 693
    },
    {
      "mi": 253.3,
      "m": 1047
    },
    {
      "mi": 262.3,
      "m": 1789
    },
    {
      "mi": 271.4,
      "m": 587
    },
    {
      "mi": 280.4,
      "m": 1530
    },
    {
      "mi": 289.5,
      "m": 912
    },
    {
      "mi": 298.5,
      "m": 1507
    },
    {
      "mi": 307.6,
      "m": 493
    },
    {
      "mi": 316.6,
      "m": 261
    },
    {
      "mi": 325.7,
      "m": 479
    },
    {
      "mi": 334.7,
      "m": 308
    },
    {
      "mi": 343.8,
      "m": 500
    },
    {
      "mi": 352.8,
      "m": 463
    },
    {
      "mi": 361.8,
      "m": 626
    },
    {
      "mi": 370.9,
      "m": 977
    },
    {
      "mi": 379.9,
      "m": 609
    },
    {
      "mi": 389,
      "m": 983
    },
    {
      "mi": 398,
      "m": 679
    },
    {
      "mi": 407.1,
      "m": 865
    },
    {
      "mi": 416.1,
      "m": 1236
    },
    {
      "mi": 425.2,
      "m": 548
    }
  ]
}
